{
  "formula": {
    "characterEstimate": "(characters + 3) // 4",
    "estimatedTokens": "max(wordEstimate, characterEstimate)",
    "wordEstimate": "(words * 3 + 1) // 2"
  },
  "highWaterEstimatedTokens": 32768,
  "metricVersion": 1,
  "profiles": [
    {
      "files": [
        {
          "characterEstimate": 1679,
          "characters": 6713,
          "estimatedTokens": 1679,
          "normalizedBytes": 6717,
          "path": "AGENTS.md",
          "sha256": "238c5c6944e28be58c434b594a8f77d1bc6ac5056cd5d03ab7f8900e6b553c8b",
          "wordEstimate": 1398,
          "words": 932
        },
        {
          "characterEstimate": 2784,
          "characters": 11133,
          "estimatedTokens": 2784,
          "normalizedBytes": 11133,
          "path": "INDEX.md",
          "sha256": "785ac7817297572cf0ae7963224ebc6cf76f5fb6275e1394ba728df4be0ecef5",
          "wordEstimate": 1484,
          "words": 989
        }
      ],
      "maxEstimatedTokens": 32768,
      "maxGrowthEstimatedTokens": null,
      "name": "startup",
      "totals": {
        "characterEstimate": 4463,
        "characters": 17846,
        "estimatedTokens": 4463,
        "normalizedBytes": 17850,
        "wordEstimate": 2882,
        "words": 1921
      }
    }
  ],
  "schemaVersion": 1,
  "warningEstimatedTokens": 26215
}
